[
  {
    "_id": "507f1f77bcf86cd799439011",
    "sensorId": "CC-001_temp_01",
    "unitId": "CC-001",
    "sensorType": "temperature",
    "value": 27.5,
    "unit": "°C",
    "timestamp": "2024-01-15T10:30:00Z",
    "quality": "good",
    "metadata": {
      "calibrationOffset": 0.2,
      "rawValue": 27.3,
      "confidence": 0.98,
      "batchId": "batch_20240115_001"
    },
    "location": {
      "latitude": 40.7128,
      "longitude": -74.0060,
      "altitude": 10
    },
    "processed": true,
    "anomaly": false,
    "createdAt": "2024-01-15T10:30:00Z",
    "updatedAt": "2024-01-15T10:30:00Z"
  },
  {
    "_id": "507f1f77bcf86cd799439012",
    "sensorId": "CC-001_pressure_01",
    "unitId": "CC-001",
    "sensorType": "pressure",
    "value": 98.7,
    "unit": "kPa",
    "timestamp": "2024-01-15T10:30:00Z",
    "quality": "good",
    "metadata": {
      "calibrationOffset": -0.1,
      "rawValue": 98.8,
      "confidence": 0.97,
      "batchId": "batch_20240115_001"
    },
    "location": {
      "latitude": 40.7128,
      "longitude": -74.0060,
      "altitude": 10
    },
    "processed": true,
    "anomaly": false,
    "createdAt": "2024-01-15T10:30:00Z",
    "updatedAt": "2024-01-15T10:30:00Z"
  },
  {
    "_id": "507f1f77bcf86cd799439013",
    "sensorId": "CC-001_flow_01",
    "unitId": "CC-001",
    "sensorType": "flow_rate",
    "value": 95.2,
    "unit": "m³/h",
    "timestamp": "2024-01-15T10:30:00Z",
    "quality": "good",
    "metadata": {
      "calibrationOffset": 0.5,
      "rawValue": 94.7,
      "confidence": 0.96,
      "batchId": "batch_20240115_001"
    },
    "location": {
      "latitude": 40.7128,
      "longitude": -74.0060,
      "altitude": 10
    },
    "processed": true,
    "anomaly": false,
    "createdAt": "2024-01-15T10:30:00Z",
    "updatedAt": "2024-01-15T10:30:00Z"
  },
  {
    "_id": "507f1f77bcf86cd799439014",
    "sensorId": "CC-001_co2_01",
    "unitId": "CC-001",
    "sensorType": "co2_concentration",
    "value": 412.8,
    "unit": "ppm",
    "timestamp": "2024-01-15T10:30:00Z",
    "quality": "good",
    "metadata": {
      "calibrationOffset": -2.1,
      "rawValue": 414.9,
      "confidence": 0.95,
      "batchId": "batch_20240115_001"
    },
    "location": {
      "latitude": 40.7128,
      "longitude": -74.0060,
      "altitude": 10
    },
    "processed": true,
    "anomaly": false,
    "createdAt": "2024-01-15T10:30:00Z",
    "updatedAt": "2024-01-15T10:30:00Z"
  },
  {
    "_id": "507f1f77bcf86cd799439015",
    "sensorId": "CC-001_humidity_01",
    "unitId": "CC-001",
    "sensorType": "humidity",
    "value": 58.3,
    "unit": "%",
    "timestamp": "2024-01-15T10:30:00Z",
    "quality": "good",
    "metadata": {
      "calibrationOffset": 1.2,
      "rawValue": 57.1,
      "confidence": 0.99,
      "batchId": "batch_20240115_001"
    },
    "location": {
      "latitude": 40.7128,
      "longitude": -74.0060,
      "altitude": 10
    },
    "processed": true,
    "anomaly": false,
    "createdAt": "2024-01-15T10:30:00Z",
    "updatedAt": "2024-01-15T10:30:00Z"
  },
  {
    "_id": "507f1f77bcf86cd799439016",
    "sensorId": "CC-001_energy_01",
    "unitId": "CC-001",
    "sensorType": "energy_consumption",
    "value": 187.4,
    "unit": "kWh",
    "timestamp": "2024-01-15T10:30:00Z",
    "quality": "good",
    "metadata": {
      "calibrationOffset": -0.8,
      "rawValue": 188.2,
      "confidence": 0.97,
      "batchId": "batch_20240115_001"
    },
    "location": {
      "latitude": 40.7128,
      "longitude": -74.0060,
      "altitude": 10
    },
    "processed": true,
    "anomaly": false,
    "createdAt": "2024-01-15T10:30:00Z",
    "updatedAt": "2024-01-15T10:30:00Z"
  },
  {
    "_id": "507f1f77bcf86cd799439017",
    "sensorId": "CC-002_temp_01",
    "unitId": "CC-002",
    "sensorType": "temperature",
    "value": 29.1,
    "unit": "°C",
    "timestamp": "2024-01-15T10:30:00Z",
    "quality": "good",
    "metadata": {
      "calibrationOffset": 0.3,
      "rawValue": 28.8,
      "confidence": 0.98,
      "batchId": "batch_20240115_001"
    },
    "location": {
      "latitude": 51.5074,
      "longitude": -0.1278,
      "altitude": 15
    },
    "processed": true,
    "anomaly": false,
    "createdAt": "2024-01-15T10:30:00Z",
    "updatedAt": "2024-01-15T10:30:00Z"
  },
  {
    "_id": "507f1f77bcf86cd799439018",
    "sensorId": "CC-002_pressure_01",
    "unitId": "CC-002",
    "sensorType": "pressure",
    "value": 97.8,
    "unit": "kPa",
    "timestamp": "2024-01-15T10:30:00Z",
    "quality": "good",
    "metadata": {
      "calibrationOffset": 0.0,
      "rawValue": 97.8,
      "confidence": 0.98,
      "batchId": "batch_20240115_001"
    },
    "location": {
      "latitude": 51.5074,
      "longitude": -0.1278,
      "altitude": 15
    },
    "processed": true,
    "anomaly": false,
    "createdAt": "2024-01-15T10:30:00Z",
    "updatedAt": "2024-01-15T10:30:00Z"
  },
  {
    "_id": "507f1f77bcf86cd799439019",
    "sensorId": "CC-002_flow_01",
    "unitId": "CC-002",
    "sensorType": "flow_rate",
    "value": 89.7,
    "unit": "m³/h",
    "timestamp": "2024-01-15T10:30:00Z",
    "quality": "warning",
    "metadata": {
      "calibrationOffset": -0.3,
      "rawValue": 90.0,
      "confidence": 0.94,
      "batchId": "batch_20240115_001"
    },
    "location": {
      "latitude": 51.5074,
      "longitude": -0.1278,
      "altitude": 15
    },
    "processed": true,
    "anomaly": false,
    "createdAt": "2024-01-15T10:30:00Z",
    "updatedAt": "2024-01-15T10:30:00Z"
  },
  {
    "_id": "507f1f77bcf86cd799439020",
    "sensorId": "CC-002_co2_01",
    "unitId": "CC-002",
    "sensorType": "co2_concentration",
    "value": 389.4,
    "unit": "ppm",
    "timestamp": "2024-01-15T10:30:00Z",
    "quality": "good",
    "metadata": {
      "calibrationOffset": 1.5,
      "rawValue": 387.9,
      "confidence": 0.96,
      "batchId": "batch_20240115_001"
    },
    "location": {
      "latitude": 51.5074,
      "longitude": -0.1278,
      "altitude": 15
    },
    "processed": true,
    "anomaly": false,
    "createdAt": "2024-01-15T10:30:00Z",
    "updatedAt": "2024-01-15T10:30:00Z"
  },
  {
    "_id": "507f1f77bcf86cd799439021",
    "sensorId": "CC-002_humidity_01",
    "unitId": "CC-002",
    "sensorType": "humidity",
    "value": 62.1,
    "unit": "%",
    "timestamp": "2024-01-15T10:30:00Z",
    "quality": "good",
    "metadata": {
      "calibrationOffset": -0.7,
      "rawValue": 62.8,
      "confidence": 0.98,
      "batchId": "batch_20240115_001"
    },
    "location": {
      "latitude": 51.5074,
      "longitude": -0.1278,
      "altitude": 15
    },
    "processed": true,
    "anomaly": false,
    "createdAt": "2024-01-15T10:30:00Z",
    "updatedAt": "2024-01-15T10:30:00Z"
  },
  {
    "_id": "507f1f77bcf86cd799439022",
    "sensorId": "CC-002_energy_01",
    "unitId": "CC-002",
    "sensorType": "energy_consumption",
    "value": 201.2,
    "unit": "kWh",
    "timestamp": "2024-01-15T10:30:00Z",
    "quality": "good",
    "metadata": {
      "calibrationOffset": 0.9,
      "rawValue": 200.3,
      "confidence": 0.97,
      "batchId": "batch_20240115_001"
    },
    "location": {
      "latitude": 51.5074,
      "longitude": -0.1278,
      "altitude": 15
    },
    "processed": true,
    "anomaly": false,
    "createdAt": "2024-01-15T10:30:00Z",
    "updatedAt": "2024-01-15T10:30:00Z"
  },
  {
    "_id": "507f1f77bcf86cd799439023",
    "sensorId": "CC-003_temp_01",
    "unitId": "CC-003",
    "sensorType": "temperature",
    "value": 26.8,
    "unit": "°C",
    "timestamp": "2024-01-15T10:30:00Z",
    "quality": "good",
    "metadata": {
      "calibrationOffset": -0.4,
      "rawValue": 27.2,
      "confidence": 0.97,
      "batchId": "batch_20240115_001"
    },
    "location": {
      "latitude": 35.6762,
      "longitude": 139.6503,
      "altitude": 5
    },
    "processed": true,
    "anomaly": false,
    "createdAt": "2024-01-15T10:30:00Z",
    "updatedAt": "2024-01-15T10:30:00Z"
  },
  {
    "_id": "507f1f77bcf86cd799439024",
    "sensorId": "CC-003_pressure_01",
    "unitId": "CC-003",
    "sensorType": "pressure",
    "value": 99.2,
    "unit": "kPa",
    "timestamp": "2024-01-15T10:30:00Z",
    "quality": "good",
    "metadata": {
      "calibrationOffset": 0.6,
      "rawValue": 98.6,
      "confidence": 0.98,
      "batchId": "batch_20240115_001"
    },
    "location": {
      "latitude": 35.6762,
      "longitude": 139.6503,
      "altitude": 5
    },
    "processed": true,
    "anomaly": false,
    "createdAt": "2024-01-15T10:30:00Z",
    "updatedAt": "2024-01-15T10:30:00Z"
  },
  {
    "_id": "507f1f77bcf86cd799439025",
    "sensorId": "CC-003_flow_01",
    "unitId": "CC-003",
    "sensorType": "flow_rate",
    "value": 112.5,
    "unit": "m³/h",
    "timestamp": "2024-01-15T10:30:00Z",
    "quality": "good",
    "metadata": {
      "calibrationOffset": 1.1,
      "rawValue": 111.4,
      "confidence": 0.96,
      "batchId": "batch_20240115_001"
    },
    "location": {
      "latitude": 35.6762,
      "longitude": 139.6503,
      "altitude": 5
    },
    "processed": true,
    "anomaly": false,
    "createdAt": "2024-01-15T10:30:00Z",
    "updatedAt": "2024-01-15T10:30:00Z"
  },
  {
    "_id": "507f1f77bcf86cd799439026",
    "sensorId": "CC-003_co2_01",
    "unitId": "CC-003",
    "sensorType": "co2_concentration",
    "value": 425.7,
    "unit": "ppm",
    "timestamp": "2024-01-15T10:30:00Z",
    "quality": "good",
    "metadata": {
      "calibrationOffset": -1.8,
      "rawValue": 427.5,
      "confidence": 0.95,
      "batchId": "batch_20240115_001"
    },
    "location": {
      "latitude": 35.6762,
      "longitude": 139.6503,
      "altitude": 5
    },
    "processed": true,
    "anomaly": false,
    "createdAt": "2024-01-15T10:30:00Z",
    "updatedAt": "2024-01-15T10:30:00Z"
  },
  {
    "_id": "507f1f77bcf86cd799439027",
    "sensorId": "CC-003_humidity_01",
    "unitId": "CC-003",